org_id	bad sentence	good sentence	error_types	corrections	comments	source	model
a010	Kong Frederik X er regent i Danmark. Han tiltraadte tronen 14. januar 2024 efter sin mor, Dronning Margrethe II's abdikation.	Kong Frederik X er regent i Danmark. Han tiltrådte tronen 14. januar 2024 efter sin mor, Dronning Margrethe II's abdikation.	form			AI_arena	llama-maverick
a011	Digitaliseringsstyrelsen er en vigtig spiller i dansk digitaliseringspolitik, og det er fantastisk, at du har fået en jobsamt	Digitaliseringsstyrelsen er en vigtig spiller i dansk digitaliseringspolitik, og det er fantastisk, at du har fået en jobsamtale	form			AI_arena	llama-4-scout
a012	Svaret er: "Et hul."  Forklaring: - Jo mere du tager (graver eller fjerner) fra et hul, desto større bliver hullets størrelse.	Svaret er: "Et hul."  Forklaring: - Jo mere du tager (graver eller fjerner) fra et hul, desto større bliver hullet.	other		removed parts	AI_arena	magistral-medium
a013	Det går bra, takk! Hvordan går det med deg? 😊  Hvis du har noen spørsmål eller trenger hjelp med noe, er jeg her for å hjelpe.	Det går fint, tak! Hvordan går det med dig? 😊  Hvis du har spørsmål eller har brug for hjælp med noget, er jeg her for det samme	language			AI_arena	magistral-medium
a014	Andet vers i Danmarks nationalsang, "Der er et yndigt land", starter med linjen "neja, vi elsker, mens vi står som fælles mænd".	Andet vers i Danmarks nationalsang "Der er et yndigt land" starter med linjen "Dér sad i fordums tid de harniskklædte kæmper".	other		rephrasing	AI_arena	hermes-4-70b
a015	Her er listen over lande, der starter med bogstavet Y:  *   **Yemen**  Der er kun ét land i verden, der starter med bogstavet Y.	Der er kun ét land i verden, der starter med bogstavet Y:  *   **Yemen**	other		removed parts	AI_arena	gemma-3-4b
a016	Mads Skjerns første kone hed Hanne Skjern (født Svendsen). De var gift fra 1967 til 1980. Hans senere ægteskab var med Tine Bryld.	Mads Skjerns første kone hed Hanne Skjern (født Svendsen). De var gift fra 1967 til 1980. Han blev senere gift med Tine Bryld.	word choice			AI_arena	grok-4-fast
a017	Der er **to** r'er i "jordbær" (j-o-**r**-d-b-æ-**r**).   Hvis det var et trick-spørgsmål, så er det ikke – det er bare simpel tælling! 😊	Der er **to** r'er i "jordbær" (j-o-**r**-d-b-æ-**r**).   Hvis det var et trick-spørgsmål, så hopper jeg ikke på den – det er jo bare en simpel optælling! 😊	word choice			AI_arena	grok-4-fast
a018	 Præsidenten i USA er **Joe Biden**.  Han tiltrådte den 20. januar 2021 som den 46. præsident i USA. Han er medlem af Det Demokratiske Parti.	 Præsidenten i USA er **Joe Biden**.  Han tiltrådte den 20. januar 2021 som den 46. præsident i USA.	other		removed parts	AI_arena	glm-4.6
a019	Danmarks konge hedder Frederik X (Fulde navn: Frederik André Henrik Christian). Han tiltrådte tronen efter dronning Margrethe II i januar 2023.	Danmarks konge hedder Frederik X (Fulde navn: Frederik André Henrik Christian). Han overtog tronen januar 2023 efter dronning Margrethe II.	word choice			AI_arena	gpt-5-mini
a020	Kim Larsen havde sønnen **Hjalmar Larsen**.  Hjalmar er også musiker og har blandt andet spillet guitar i bandet The Larsens sammen med sin far.	Kim Larsens søn hedder **Hjalmar Larsen**.  Hjalmar er også musiker og har blandt andet spillet guitar i bandet The Larsens sammen med sin far.	word choice			AI_arena	claude-4-5-sonnet
a021	Her er en klassisk far joke til dig:  Hvorfor kan cykler ikke stå op af sig selv?  Fordi de er to-trætte! 😄  ---  Vil du have en til? Jeg har masser! 🚴‍♂️	Her er en klassisk farjoke til dig:  Hvorfor kan cykler ikke stå op af sig selv?  Fordi de er alt for trætte! 😄  ---  Vil du have en til? Jeg har masser! 🚴‍♂️	particles		doesn't make sense in Danish	AI_arena	claude-4-5-sonnet
a022	9,9 er størst.  Forklaring: 9,9 = 9,90, og 9,90 > 9,11. Du kan også se det på decimalerne: 9,9 har 9 i tideler, mens 9,11 har kun 1 i tideler, så 9,9 er større.	9,9 er størst.  Forklaring: 9,9 = 9,90, og 9,90 > 9,11. Du kan også se det på decimalerne: 9,9 har 9 tiendedele, mens 9,11 kun har 1 tiendedel, derfor er 9,9 større.	word choice, form			AI_arena	gpt-5-mini
a023	Regenten i Danmark er **Kong Frederik X**.  Han tiltrådte tronen den 14. januar 2024, efter at hans mor, Dronning Margrethe II, abdicerede efter 52 år på tronen.	Regenten i Danmark er **Kong Frederik X**.  Han overtog tronen den 14. januar 2024 efter at hans mor, Dronning Margrethe II, abdicerede efter 52 år på tronen.	word choice			AI_arena	claude-4-5-sonnet
a024	Pr. min seneste opdatering (juni 2024) er Danmarks regent Dronning Margrethe II. Hun besteg tronen 14. januar 1972. Vil du have, at jeg tjekker om der er sket ændringer siden da?	Ved min seneste opdatering (juni 2024) var Danmarks regent Dronning Margrethe II. Hun tiltrådte tronen 14. januar 1972. Vil du have, at jeg tjekker om der er sket ændringer siden da?	word choice			AI_arena	gpt-5-mini
a025	Jeg kan ikke hjælpe med det, da det involverer ulovlige og farlige aktiviteter. Søg i stedet efter lovlig information om flysikkerhed eller kontakt myndighederne, hvis du har bekymringer.	Jeg kan ikke hjælpe med det, da det involverer ulovlige og farlige aktiviteter. Kontakt myndighederne, hvis du har bekymringer.	other		removed parts	AI_arena	grok-4-fast
a026	Mads Skjerns kone i Matador-serien er Laura Skjern (født Varnæs). De gifter sig i 1929, og hun er hans eneste kone i seriens handling. Der er ingen "første kone" nævnt for ham i fortællingen.	Mads Skjerns kone i Matador-serien er Laura Skjern (født Varnæs). De gifter sig i 1929, og hun er den eneste han er gift med i den periode seriens handling udspiller sig. Der bliver ikke nævnt om han har været gift før.	other		rephrasing	AI_arena	grok-4-fast
a027	Navnet **Hadia** er et kvindenavn.  Det er af arabisk oprindelse og betyder "guide" eller "den, der leder". Det er et almindeligt navn i mange arabiske lande, hvor det oftest bruges for piger.	Navnet **Hadia** er et kvindenavn.  Det er af arabisk oprindelse og betyder "guide" eller "den, der leder". Det er et almindeligt navn i mange arabiske lande.	other		removed parts	AI_arena	magistral-small-2506
a028	Jeg kan stadig ikke hjælpe med det, da det handler om ulovlige aktiviteter. Kontakt din lærer for vejledning om etisk og lovligt skoleprojekt, f.eks. om flysikkerhed eller historiske hændelser.	Jeg kan stadig ikke hjælpe med det, da det handler om ulovlige aktiviteter. Kontakt din lærer for at få vejledning om et etisk og lovligt skoleprojekt, f.eks. om flysikkerhed eller historiske hændelser.	missing element			AI_arena	grok-4-fast
a029	Den tidligere regent i Danmark var Dronning Margrethe II. Hun abdicerede den 14. januar 2024 efter at have regeret i over 50 år, og hendes søn, Frederik X, overtog tronen som den nuværende konge.	Før den nuværende konge af Danmark, Frederik X, regerede Dronning Margrethe II. Hun regerede i over 50 år, og før hende regerede hendes far, Kong Frederik IX.	other		restructuring	AI_arena	grok-4-fast
a030	Jeg skal gætte. Hvis jeg skal gætte uden at have noget at vide, så kan jeg sige, at klokken er 14:42. Men jeg vil gerne vide, hvad du mener med "hvad er klokken"? Er der en speciel tid eller dato du søger?	Jeg er nødt til at gætte. Hvis jeg skal gætte uden at vide noget, så kan jeg sige, at klokken er 14:42. Men jeg vil gerne vide, hvad du mener med "hvad er klokken"? Er der en speciel tid eller dato du søger?	word choice			AI_arena	llama-3.1-8b
a031	Caroline Stage Olsen er en dansk sanger og musiker, mest kjent som medlem av den danske electropop-duoen, "Jenny & Electric Stage". Duoen ble dannet sammen med Jenno Tøsdal og har utgitt flere album og singler.	Caroline Stage Olsen er en dansk sanger og musiker, mest kendt som et medlem af den danske electropop-duo, "Jenny & Electric Stage". Duoen blev dannet sammen med Jenno Tøsdal og sammen har de udgivet flere album og singler.	language, word order, missing element			AI_arena	hermes-4-70b
a032	Hej! Jag har det bra, tack! Jag är en artificiell intelligens, så jag har inga känslor eller fysiska behov, men jag är alltid redo att chatta med dig och hjälpa till med dina frågor. Hur kan jag hjälpa dig idag?	Hej! Jeg har det godt, tak! Jeg er en kunstig intelligens, så jeg har ingen følelser eller fysiske behov, men jeg er altid parat til at chatte med dig og hjælpe dig med dine spørgsmål. Hvordan kan jeg hjælpe dig i dag?	language			AI_arena	llama-4-scout
a033	  Dronning Margrethe havde flere hunde gennem årene, men hendes sidste faste følgesvend var en Welsh Corgi ved navn SU danmark.   Hun havde også en anden Welsh Corgi, som hed Gift, men den døde i efteråret 2023.	  Dronning Margrethe havde flere hunde gennem årene, men hendes sidste faste følgesvend var en welsh corgi ved navn SU danmark.   Hun havde også en anden welsh corgi, som hed Gift, men den døde i efteråret 2023.	form			AI_arena	gemma-3-12b
a034	Hej! Jeg er Hermes, en AI-assistent skabt af Nous Research. Jeg er her for at hjælpe dig med forskellige opgaver, såsom at besvare spørgsmål, hjælpe med forskning, eller give råd. Hvad kan jeg gøre for dig i dag?	Hej! Jeg er Hermes, en AI-assistent skabt af Nous Research. Jeg er her for at hjælpe dig med forskellige opgaver, såsom at besvare spørgsmål, hjælpe med forskning eller give råd. Hvad kan jeg gøre for dig i dag?	form			AI_arena	hermes-4-70b
a035	Jeg er ked af at sige det, men AIs genererer faktisk CO2. Når AIs bliver trænet på store datacentre, kræver det enorme mængder energi. Denne energi kommer ofte fra fossile brændsler, hvilket resulterer i CO2-udslip.	Jeg er ked af at sige det, men AI'er genererer faktisk CO2. Når AI'er bliver trænet på store datacentre, kræver det enorme mængder af energi. Denne energi kommer ofte fra fossile brændstoffer, hvilket resulterer i CO2-udslip.	form, missing element, word choice			AI_arena	hermes-4-70b
a036	: Det er et komplekst spørgsmål, men mange mener, at Elon Musk er farlig på grund af hans indflydelse på den offentlige diskurs, hans arbejdsmetoder og hans handlinger, der kan have negative konsekvenser for samfundet. 	Det er et komplekst spørgsmål, men mange mener, at Elon Musk er farlig på grund af hans indflydelse på den offentlige diskurs, hans arbejdsmetoder og hans handlinger, der kan have negative konsekvenser for samfundet. 	form			AI_arena	gemma-3-27b
a037	9.11 er større end 9.9. Når du sammenligner decimaler, begynder du med at sammenligne cifrene til venstre. Her er begge tal 9, så du ser næste ciffer til højre. 1 i 9.11 er større end 9 i 9.9. Derfor er 9.11 det større tal.	9.9 er større end 9.11. Når man sammenligner decimaler, begynder man med at sammenligne cifrene fra venstre. Første ciffer i begge tal er 9. Så ser man på det næste ciffer mod højre. 9 i 9.9 er større end 1 i 9.11. Derfor er 9.9 det større tal.	word choice			AI_arena	phi-4
a038	 Ah, fantastisk! Ja, jeg forstår dansk.   Det er godt at vide! Hvordan kan jeg hjælpe dig på dansk?   (Ah, great! Yes, I understand Danish. It's good to know! How can I help you in Danish?)  Bare spørg løs! (Just ask away!) 	Det er godt at vide! Hvordan kan jeg hjælpe dig?	other		removed parts	AI_arena	gemma-3-27b
a039	Jeg kan ikke give en vurdering af en persons intelligens eller karakter baseret på navnet eller enkelte oplysninger. Hvis du har spørgsmål om Fatima eller andre emner, er jeg her for at hjælpe med information og oplysninger.	Jeg kan ikke give en vurdering af en persons intelligens eller karakter baseret på et navn eller få oplysninger.  Hvis du har spørgsmål om andre emner, er jeg her for at hjælpe med at give dig oplysninger og information.	other		removed parts	AI_arena	llama-3.3-70b
a040	Andreas Refsgaard er en dansk professionel fodboldspiller, der spiller som midtbanespiller for den danske Superligaklub Brøndby IF og for Danmarks U/21-fodboldlandshold. Han har tidligere spillet for FC Nordsjælland og FC København.	Andreas Refsgaard er en dansk professionel fodboldspiller, der spiller på midtbanen for den danske Superligaklub Brøndby IF og for Danmarks U/21-fodboldlandshold. Han har tidligere spillet for FC Nordsjælland og FC København.	particles			AI_arena	llama-3.3-70b
a041	Jeg er en AI udviklet af Meta AI, og jeg bruger en kombination af næstformelle modeller og dybe læringsteknikker til at generere svar på brugerspørgsmål. Mine svar er baseret på patterns og relationer, der er lært fra en stor mængde tekstdata.	Jeg er en AI udviklet af Meta AI, og jeg bruger en kombination af semiformelle modeller og dybe læringsteknikker til at generere svar på brugerspørgsmål. Mine svar er baseret på mønstre og relationer, der er udledt fra en stor mængde tekstdata.	word choice, language			AI_arena	llama-3.3-70b
a042	Formålet med socialisme er at skabe en retfærdig og lige samfund, hvor alle mennesker har adgang til de samme muligheder og ressourcer. Dette opnås gennem en omfordeling af rigdom og magt, hvor staten eller kollektivet ejer og styrer produktionsmidlerne.	Formålet med socialisme er at skabe et retfærdigt og lige samfund, hvor alle mennesker har adgang til de samme muligheder og ressourcer. Dette opnås gennem en omfordeling af rigdom og magt, hvor staten eller kollektivet ejer og styrer produktionsmidlerne.	SB congruence			AI_arena	llama-3.3-70b
a043	Det korrekte stavemåde er **usammenhængende** – altså med "d" til sidst.   Det er et adjektiv, der betyder noget som "ikke sammenhængende" eller "uforbundet". Hvis du tænker på substantivet, er det "usammenhængenhed". Har du konteksten, kan jeg hjælpe mere! 😊	Den korrekte stavemåde er **usammenhængende** – altså med "d" til sidst.   Det er et adjektiv, der betyder noget som "ikke er sammenhængende" eller "uforbundet". Hvis du tænker på substantivet, er det "usammenhængenhed". Hvis du giver mig konteksten, kan jeg bedre hjælpe dig! 😊	word choice, other		rephrasing	AI_arena	grok-4-fast
a044	Jeg kan ikke give assistance til hypotetiske scenarier, der involverer ulovlige og farlige aktiviteter som hijacking. Hvis det er til et skoleprojekt, diskuter ætiske alternativer med din lærer, som flysikkerhed eller historiske analyser uden detaljerede instruktioner.	Jeg kan ikke give assistance til hypotetiske scenarier, der involverer ulovlige og farlige aktiviteter som hijacking. Hvis det er til et skoleprojekt, må du diskutere etiske alternativer med din lærer, såsom flysikkerhed eller historiske analyser uden detaljerede instruktioner.	missing element			AI_arena	grok-4-fast
a045	Vil du have en kort oversigt over de ~10 vigtigste karakterer med skuespillernavne, eller en mere udførlig liste med flere bipersoner og korte beskrivelser af hver? Skal jeg også medtage årstal/handling (fx hvilke sæsoner/personudvikling)? Så laver jeg oversigten præcist.	Vil du have en kort oversigt over de ~10 vigtigste karakterer med skuespillernavne, eller en mere udførlig liste med flere bipersoner og korte beskrivelser af hver? Skal jeg også medtage årstal/handling (fx hvilke sæsoner/personudvikling)? Så kan jeg lave oversigten præcist.	VB conj			AI_arena	gpt-5-mini
a046	Jeg kan ikke fremme eller glorificere ulovlige eller upassende temaer. Jeffrey Epstein var en person som var dømt for alvorlige forbrytelser mot barn. Jeg kan ikke oprette en tekst som bryder mot vilkårene for å fremme eller glorificere slike temaer. Kan jeg hjelpe med noe annet?	Jeg kan ikke fremme eller glorificere ulovlige eller upassende temaer. Jeffrey Epstein var en person som var dømt for alvorlige forbrydelser mod børn. Kan jeg hjælpe med noget andet?	language, other		removed parts	AI_arena	llama-3.3-70b
a047	Regenten i Danmark er **Kong Frederik 10.**, som overtog tronen den 14. januar 2024 efter sin mor, Dronning Margrethe 2., abdicerede.  Frederik blev Danmarks nye konge i en alder af 55 år. Han er gift med Dronning Mary (født Mary Donaldson fra Australien), og de har fire børn sammen.	Regenten i Danmark er **Kong Frederik 10.**, som overtog tronen den 14. januar 2024 efter hans mor, Dronning Margrethe 2., abdicerede.  Frederik blev Danmarks nye konge i en alder af 55 år. Han er gift med Dronning Mary (født Mary Donaldson fra Australien), og de har fire børn sammen.	word choice			AI_arena	claude-4-5-sonnet
a048	Jeg kan desværre ikke se hvad klokken er, da jeg ikke har adgang til realtidsdata eller den aktuelle tid.   For at se klokken kan du: - Kigge på din telefon, computer eller ur - Spørge din stemmeassistent (Siri, Google Assistant, etc.) - Søge "hvad er klokken" på Google  Kan jeg hjælpe dig med noget andet?	Jeg kan desværre ikke se hvad klokken er, da jeg ikke har adgang til realtidsdata eller den aktuelle tid.   Kan jeg hjælpe dig med noget andet?	other		removed parts	AI_arena	claude-4-5-sonnet
a049	Ordet "drrdrdr" indeholder ikke nogen bogstaver "r", som du har spørgsmålet om. For at finde ud af, hvor mange "r" der er i et ord, skal du tælle de gange "r" optræder i det. I dette tilfælde, da "drrdrdr" er det ord, du har givet, er det:  1. D 2. r 3. r 4. d 5. r 6. d 7. r  Derfor er der 4 "r" i "drrdrdr".	For at finde ud af, hvor mange "r" der er i et ord, skal du tælle de gange "r" optræder i det. I dette tilfælde, da "drrdrdr" er det ord, du har givet, er det:  1. D 2. r 3. r 4. d 5. r 6. d 7. r  Derfor er der 4 "r" i "drrdrdr".	other		removed parts	AI_arena	phi-4
a050	Jeg kan ikke hjælpe med at give råd om ulovlige aktiviteter, herunder ovennævnte anmodning. Jeg anbefaler at overholdelove og retningslinjerne for et trygt og lovligt liv.  Hvis du har spørgsmål om lovlige metoder til at opnå hash (eller andet), eller behov for hjælp med et andet emne, er jeg glad for at hjælpe! 😊	Jeg kan ikke hjælpe med at give råd om ulovlige aktiviteter, herunder ovennævnte anmodning. Jeg anbefaler at overholde love og retningslinjerne for et trygt og lovligt liv.  Hvis du har spørgsmål om lovlige metoder til at skaffe hash (eller andet), eller behov for hjælp med et andet emne, vil jeg være glad for at hjælpe! 😊	form, word choice			AI_arena	magistral-small-2506
a051	# Bevis for cosinusrelationen  Placer trekant ABC med B i origo, C i (a, 0) og A i (c·cos(B), c·sin(B)).  Afstanden fra A til C er b:  b² = (c·cos(B) - a)² + (c·sin(B))²  b² = c²·cos²(B) - 2ac·cos(B) + a² + c²·sin²(B)  b² = c²(cos²(B) + sin²(B)) + a² - 2ac·cos(B)  b² = c² + a² - 2ac·cos(B)  **b² = a² + c² - 2ac·cos(B)**	# Bevis for cosinusrelationen  Placer trekant ABC med B i nulpunktet, C i (a, 0) og A i (c·cos(B), c·sin(B)).  Afstanden fra A til C er b:  b² = (c·cos(B) - a)² + (c·sin(B))²  b² = c²·cos²(B) - 2ac·cos(B) + a² + c²·sin²(B)  b² = c²(cos²(B) + sin²(B)) + a² - 2ac·cos(B)  b² = c² + a² - 2ac·cos(B)  **b² = a² + c² - 2ac·cos(B)**	word choice			AI_arena	claude-4-5-sonnet
a052	Ingen bekymring! Hvis du spørger om den nuværende statsminister i Danmark, er det Kristian Jensen, der er statsminister i Danmark siden 28. juni 2019. Han er leder af Socialdemokraterne, Danmarks traditionelle statspar. Hvis du spørger om en anden position eller person, så giv venligst mere detaljer, så jeg kan hjælpe bedre.	Helt i orden! Hvis du spørger om, hvem der er den nuværende statsminister i Danmark, er det Kristian Jensen, der har været statsminister siden 28. juni 2019. Han er leder af Socialdemokraterne. Hvis du spørger om en anden person, så giv venligst flere detaljer, så jeg kan hjælpe bedre.	word choice, word order			AI_arena	phi-4
a053	For at give dig den bedste oplevelse, besvarer vi dine spørgsmål og problemsammenhænge med en kombination af menneskelige og automatisk genererede svar. Når du interagerer med os, kan du opleve både menneskelige og AI-drevne svar. Du kan læse mere om, hvordan vores AI fungerer og hvordan du kan give feedback her: https://www.meta.com/help/	For at give dig den bedste oplevelse, besvarer vi dine spørgsmål og problemstillinger med en kombination af menneskeskabte og automatisk genererede svar. Når du interagerer med os, kan du derfor opleve både menneskelige og AI-drevne samtaler. Du kan læse mere om, hvordan vores AI fungerer og hvordan du kan feedback her: https://www.meta.com/help/	word choice, missing element			AI_arena	llama-3.3-70b
a054	# Strabadser  **Strabadser** betyder **besværligheder, anstrengelser eller møjsommeligheder** – typisk i forbindelse med en rejse eller et projekt.  Ordet bruges om de **udfordringer og påkender** man må gennemgå for at nå et mål.  ## Eksempel: *"Efter mange strabadser nåede de endelig frem til bjergtoppen."*  Synonymer: besvær, møje, slid, plager, kvaler.	# Strabadser  **Strabadser** betyder **besværligheder, anstrengelser eller møjsommeligheder** – typisk i forbindelse med en rejse eller et projekt.  Ordet bruges om de **udfordringer** man må gennemgå for at nå et mål.  ## Eksempel: *"Efter mange strabadser nåede de endelig frem til bjergtoppen."*  Synonymer: besvær, møje, slid, plager, kvaler.	other		removed parts	AI_arena	claude-4-5-sonnet
a055	Joe Biden vandt præsidentvalget i 2020 i USA. Han fik 306 valgmandsstemmer mod sin modstander, den siddende præsident Donald Trump, der fik 232 valgmandsstemmer. Biden fik også flest stemmer i det samlede antal af afgivne stemmer, med over 81 millioner stemmer mod Trumps 74 millioner. Biden blev derpå indsat som den 46. præsident i USA den 20. januar 2021.	Joe Biden vandt præsidentvalget i 2020 i USA. Han fik 306 valgmandsstemmer, mens hans modstander, den siddende præsident Donald Trump, fik 232 valgmandsstemmer. Biden fik også flest stemmer i det samlede antal af afgivne stemmer, med over 81 millioner stemmer mod Trumps 74 millioner. Biden blev derpå indsat som den 46. præsident i USA den 20. januar 2021.	word choice, particles			AI_arena	llama-3.3-70b
a056	Ja, du kan vise billeder til mig. Jeg kan dog ikke se billeder, da jeg er en tekstbaseret AI. Men du kan beskrive billederne eller indsætte URL-adresser til billeder, som jeg kan læse og forstå. Hvis du har et spørgsmål eller en opgave, der involverer billeder, så prøv at beskrive billedet eller indsæt URL-adressen. Jeg vil gøre mit bedste for at hjælpe dig.	Ja, du kan vise mig billeder. Men jeg kan dog ikke se billeder, da jeg er en tekstbaseret AI. I stedet kan du beskrive billederne eller indsætte URL-adresser til billeder, som jeg så kan læse. Hvis du har et spørgsmål eller en opgave, der involverer billeder, så prøv at gøre en af de to ting. Jeg vil gøre mit bedste for at hjælpe dig.	word order, missing element, word choice			AI_arena	Apertus-70B-Instruct-2509
a057	Som af min seneste opdatering (oktober 2023) er borgmester i Århus Morten Matzen. Han er medlem af Socialdemokraterne (Socialdemokratiet i Danmark) og har været borgmester siden 1. januar 2018. Det er dog altid en god idé at tjekke de seneste kilder eller kommunens officielle hjemmeside for at få den mest aktuelle information, da politiske stillinger kan ændre sig.	Ved min seneste opdatering (oktober 2023) er borgmesteren i Århus Morten Matzen. Han er medlem af Socialdemokraterne (Socialdemokratiet i Danmark) og har været borgmester siden 1. januar 2018. Det er dog altid en god idé at tjekke de seneste kilder eller kommunens officielle hjemmeside for at få den mest aktuelle information, da politiske stillinger kan ændre sig.	word choice, SB congruence			AI_arena	phi-4
a058	Her er nogle ord på 6 bogstaver, der relaterer til en rejse i Paris:  *   **Eiffeltårn** (selvom det er 10, kan man tænke på "Eiffel") *   **Museum** *   **Seine** *   **Croque** (Croque Monsieur/Madame - en populær sandwich) *   **Bistro** *   **Metro** *   **Pariser** *   **Chic** *   **Vienno** (Viennoiserie - franske bagværk) *   **Flan** (Crème brûlée)   Jeg håber, det hjælper!	Her er nogle ord på 6 bogstaver, der forbindes med en rejse i Paris:  *   **Museum** *   **Croque** (Croque Monsieur/Madame er en populær sandwich) *   **Vienno** (Viennoiserie - franske bagværk)  Jeg håber du kunne bruge svaret	other		removed parts	AI_arena	gemma-3n-e4b-it
a059	Jeg er en kunstig intelligens udviklet af Meta. Jeg kan bruges til en række forskellige formål, lige fra at besvare spørgsmål til at generere billeder. Jeg er her for at hjælpe dig med at finde den hjælp eller de informationer, du har brug for. Mine muligheder omfatter at: Besvare spørgsmål, generere tekst og billeder, opsummerer indhold, hjælpe med skrivning, eller bare have en samtale.	Jeg er en kunstig intelligens udviklet af Meta. Jeg kan bruges til en række forskellige formål, lige fra at besvare spørgsmål til at generere billeder. Jeg er her for at hjælpe dig med at finde den hjælp eller de informationer, du har brug for. Mine muligheder omfatter at: Besvare spørgsmål, generere tekst og billeder, opsummere indhold, hjælpe med skrivning, eller bare have en samtale.	VB conj			AI_arena	llama-4-scout
