org_id	bad sentence	good sentence	error_types	corrections	comments	source	model
c0150	Hvad skal jeg skrive? Det er bare så længe siden jeg forlod Glasgow, og nu sidder jeg her på Eilean Donan, alene med mit tænke.	Hvad skal jeg skrive? Det er bare så længe siden jeg forlod Glasgow, og nu sidder jeg her på Eilean Donan, alene med mine tanker.	SB congruence, word choice			creative writing	meta-llama_Llama-3.1-8B-Instruct
c0151	Jeg håber, du sender mig noget breve snart.	Jeg håber, du sender mig et brev snart.	adverbs			creative writing	meta-llama_Llama-3.1-8B-Instruct
c0152	Sconerne var som en lille smag af hjemme, og bogen af Irvine Welsh var så god, at jeg ikke kunne slukke for lampen før jeg havde læst den hele.	Sconesene smagte lidt af hjemmebag, og bogen af Irvine Welsh var så god, at jeg ikke slukkede lyset før jeg havde læst den til ende.	word choice			creative writing	meta-llama_Llama-3.1-8B-Instruct
c0196	Arthur følte en stikker af spænding. "Et tilbud?"	Arthur mærkede et stik af spænding. "Et tilbud?"	word choice			creative writing	meta-llama_Llama-3.1-8B-Instruct
c0197	Min navn er Maya, og jeg er en biohacker, der har tilbragt hele mit liv med at eksperimentere med livets byggesten.	Min navn er Maya. Jeg er biohacker og har tilbragt hele mit liv med at eksperimentere med livets byggesten.	particles			creative writing	meta-llama_Llama-3.1-8B-Instruct
c0198	Men den genteknologi, der er til rådighed, er ikke til at stole på. Den er konstrueret til at holde kun én generation, før den begynder at nedbryde sig selv.	Men den genteknologi, der er til rådighed, er ikke til at stole på. Den er konstrueret til kun at holde én generation, før den begynder at nedbryde sig selv.	word order			creative writing	meta-llama_Llama-3.1-8B-Instruct
c0199	Jeg føler en følelse af tryghed, da hun omfavner mig. Jeg føler, at jeg kan åbne op og være mig selv.	Jeg får en følelse af tryghed, da hun omfavner mig. Jeg føler, at jeg kan åbne op og være mig selv.	word choice			creative writing	meta-llama_Llama-3.1-8B-Instruct
c0200	Han var klædt i en fin, sort kost, og hans ansigt var omgivet af et tykt skær af rødlig hud, der gjorde ham til en skræmmende syn.	Han var klædt i en fin, sort kappe, og han var omgivet af et lys der gav hans ansigt et rødligt skær. Det gjorde ham til en skræmmende syn.	other, word choice		rephrasing	creative writing	meta-llama_Llama-3.1-8B-Instruct
c0201	Aya følte en kulde, der strømmede gennem hendes krop. Hun var fanget. Hun kunne se det i gildelederens øjne, og hun vidste, at hun var ved at tabe kontrol over situationen.	Aya mærkede en kulde, der strømmede gennem hendes krop. Hun var fanget. Hun kunne se det i gildelederens øjne, og hun vidste, at hun var ved at miste kontrollen over situationen.	word choice			creative writing	meta-llama_Llama-3.1-8B-Instruct
c0202	Jeg kommer fra... overalt, svarer han med en smil, der får mine anelser til at vokse.	Jeg kommer fra... overalt, svarer han med en smil, der bekræfter mine bange anelser.	word choice			creative writing	meta-llama_Llama-3.1-8B-Instruct
c0203	Jeg skubber flasken til siden og henter en ny glas. Når jeg vender mig tilbage, har han allerede betalt med en håndfuld krediter, der glider over baren som en løber.	Jeg skubber flasken til side og henter et nyt glas. Da jeg vender mig tilbage, har han allerede betalt med en håndfuld mønter, der glider over baren.	word choice			creative writing	meta-llama_Llama-3.1-8B-Instruct
c0204	Da jeg stod op, følte jeg den kolde sten under mine fødder. Jeg gik hen til den lille statue af Mitra, min yndlingsguddom, der stod i hjørnet af min celle.	Da jeg stod op, følte jeg det kolde stengulv under mine fødder. Jeg gik hen til den lille statue af Mitra, min yndlingsguddom, der stod i hjørnet af min celle.	word choice			creative writing	meta-llama_Llama-3.3-70B-Instruct
c0205	Luften var fyldt med lyden af stål, der klirrede mod stål, og mænd, der puffede og stønnede.	Luften var fuld af den klirrende lyd af stål mod stål, og mænd, der puffede og stønnede.	form			creative writing	meta-llama_Llama-3.3-70B-Instruct
c0206	Jeg gik hen til vores træner, en gammel gladiator, der havde overlevet mange kampe. Han så på mig og nikkede. "I dag skal vi træne med net og svard," sagde han.	Jeg gik hen til vores træner, en gammel gladiator, der havde overlevet mange kampe. Han så på mig og nikkede. "I dag skal vi træne med net og sværd," sagde han.	form		spelling error	creative writing	meta-llama_Llama-3.3-70B-Instruct
c0207	Jeg håber, dette brev finder dig i godt helbred.	Jeg håber du har det godt.	other		rephrasing	creative writing	meta-llama_Llama-3.3-70B-Instruct
c0208	Jeg er nu på min postering på Eilean Mòr Fyr, og det er en smule svært at vænne sig til isolationen her.	Jeg er nu på min post på Eilean Mòr Fyr, og det er lidt svært at vænne sig til isolationen her.	word choice			creative writing	meta-llama_Llama-3.3-70B-Instruct
c0209	Jeg er så glad for at høre fra dig! Jeg var begyndt at bekymre mig, da jeg ikke havde hørt noget fra dig i så længe.	Jeg er så glad for at høre fra dig! Jeg var begyndt at blive bekymret, da jeg ikke havde hørt fra dig længe.	word choice			creative writing	meta-llama_Llama-3.3-70B-Instruct
c0211	Undskyld, jeg håber ikke jeg forstyrrer, sagde skuespilleren, da han trådte ind i den lille byboghandel.	Undskyld, jeg håber jeg ikke forstyrrer, sagde skuespilleren, da han trådte ind i den lille boghandel.	word choice, word order			creative writing	meta-llama_Llama-3.3-70B-Instruct
c0212	Boghanderen, en kvinde med langt, mørkt hår og briller, så op fra disken, hvor hun var i gang med at pakke bogbestillinger ind. "Ikke overhovedet," sagde hun med en venlig, men ikke særlig imødekommende tone. "	Boghandleren, en kvinde med langt, mørkt hår og briller, så op fra disken, hvor hun var i gang med at pakke bogbestillinger ind. "overhovedet ikke," sagde hun med en høflig, men ikke særlig imødekommende tone. "	word order, word choice			creative writing	meta-llama_Llama-3.3-70B-Instruct
c0213	Skuespilleren lo og gik hen til en hylderæk med klassikere. "Jeg elsker denne type boghandlere," sagde han. "Der er noget så hyggeligt over at være omgivet af bøger."	Skuespilleren lo og gik hen til en hylderække med klassikere. "Jeg elsker den her slags boghandlere," sagde han. "Der er noget meget hyggeligt over at være omgivet af bøger."	word choice			creative writing	meta-llama_Llama-3.3-70B-Instruct
c0215	Vi satte os i gang, Chewy sikkert fastholdt i min arm, og Midas førte an. Vi gik gennem den øde landsby, forbi ruinerne af husene og butikkerne.	Vi begav os afsted, Chewy holdt sikkert fast i min arm, og Midas førte an. Vi gik gennem den øde landsby, forbi det der var tilbage af de ødelagt huse og butikker.	word choice, word order			creative writing	meta-llama_Llama-3.3-70B-Instruct
c0217	Inde i fabrikken var der mørkt og stille, og jeg kunne høre lyden af mine egne skridt ekkoer af væggene.	Inde i fabrikken var der mørkt og stille, og jeg kunne høre lyden af mine egne skridt give ekko mod væggene.	word choice			creative writing	meta-llama_Llama-3.3-70B-Instruct
c0218	De så ud til at være overlevende, ligesom os, men de så også ud til at være i en dårlig humør.	De så ud til at være i live, ligesom os, men de så også ud til at være i dårligt humør.	other, word choice		rephrasing	creative writing	meta-llama_Llama-3.3-70B-Instruct
c0219	Er du sikker på, du vil være her? spurgte jeg, og min stemme var mere end bare en spørgsmål.	Er du sikker på, du vil være her? spurgte jeg, og det var mere end bare et spørgsmål.	language			creative writing	meta-llama_Llama-3.3-70B-Instruct
c0220	Hun var på vej til at aflevere en pakke, da hun pludselig fik øje på en mand, der stod og stirrede på en guidebog, helt opslugt af sine egne tanker.	Hun var på vej til at aflevere en pakke, da hun pludselig fik øje på en mand, der stod og stirrede i en guidebog, helt opslugt af sine egne tanker.	particles			creative writing	meta-llama_Llama-3.3-70B-Instruct
c0221	De talte videre og fik at vide, at de havde mange fælles interesser, selv om de kom fra forskellige kulturer og havde forskellige baggrunde.	De talte videre og opdagede, at de havde mange fælles interesser, selv om de kom fra forskellige kulturer og havde forskellige baggrunde.	word choice			creative writing	meta-llama_Llama-3.3-70B-Instruct
c0222	Undervejs standsede de ved en lille café, hvor Alessandra bestilte to kop kaffe og en kanne vand.	På vejen standsede de ved en lille café, hvor Alessandra bestilte to kopper kaffe og en kande vand.	word choice			creative writing	meta-llama_Llama-3.3-70B-Instruct
c0223	Jeg stod i mørkekammeret, omgivet af det røde lys, der skabte en varm og intimitetfuld atmosfære.	Jeg stod i mørkekammeret, omgivet af rødt lys, der skabte en varm og intim atmosfære.	word choice			creative writing	meta-llama_Llama-3.3-70B-Instruct
c0224	Mens vi arbejdede, skete der et uheld. En stak fotopapir blev eksponeret og blev ubrugelig.	Mens vi arbejdede, skete der et uheld. En stak med fotopapirer blev eksponeret, og de blev ubrugelige.	missing element, ADJ congruence			creative writing	meta-llama_Llama-3.3-70B-Instruct
c0225	Hun tager sin telefon op for at tjekke klokken, og jeg ser mønstret. Det er et usikkert mønster, et mønster, der er alt for let at gætte. Jeg kan ikke lade være med at kommentere på det. "Hey, du burde virkelig skifte til et mere sikkerhedsmæssigt mønster," siger jeg. "Det dér er alt for let at gætte."	Hun tager sin telefon op for at tjekke klokken, og jeg ser det mønster hun tegner for at lukke telefonen op. Det er en usikker kode, et mønster, der er alt for let at gætte. Jeg kan ikke lade være med at kommentere på det. "Hey, du burde virkelig skifte til en mere sikker kode," siger jeg. "Det dér er alt for let at gætte."	word choice			creative writing	meta-llama_Llama-3.3-70B-Instruct
c0226	Jeg er ked af det, siger jeg hurtigt. "Jeg er bare så vant til at tænke om sikkerhed, at jeg ikke kan lade være med at se sårbarheder overalt." Jeg prøver at le det af, men jeg kan se, at hun ikke er overbevist.	Undskyld siger jeg hurtigt. "Jeg er bare så vant til at tænke på sikkerhed, at jeg ikke kan lade være med at se sårbarheder overalt." Jeg prøver at grine det af, men jeg kan se, at hun ikke er overbevist.	word choice, particles			creative writing	meta-llama_Llama-3.3-70B-Instruct
c0227	Hej, hvor er du fra? Nej, for dumt. Han ved allerede, hvor jeg er fra. Vi har gået i skole sammen siden 4. klasse. Lad os prøve noget andet. Hvad synes du om dette projekt? For åbenbart. Han har sikkert allerede en mening om det, og jeg vil bare lyde som en kopi af ham.	Hej, hvor er du fra? Nej, for dumt. Han ved allerede, hvor jeg er fra. Vi har gået i skole sammen siden 4. klasse. Lad os prøve noget andet. Hvad synes du om det her projekt? For åbenlyst. Han har sikkert allerede en mening om det, og jeg kommer bare til at lyde som en kopi af ham.	word choice			creative writing	meta-llama_Llama-3.3-70B-Instruct
c0228	Læreren spørger os om at arbejde i par for at løse en opgave, og jeg føler, hvordan mit hjerte begynder at banke hurtigere.	Læreren beder os om at løse opgaven to og to, og jeg mærker, hvordan mit hjerte begynder at banke hurtigere.	word choice			creative writing	meta-llama_Llama-3.3-70B-Instruct
c0229	Jeg har ikke set hende i flere dage, og jeg kan mærke min forladthedsangst krybe op ad mine ben som en kold, klam sved. Hvad hvis hun ikke gider mere? Hvad hvis hun har fundet en anden?	Jeg har ikke set hende i flere dage, og jeg kan mærke angsten for at blive forladt kryber ind i min krop, og jeg får koldsved. Hvad hvis hun ikke vil mere? Hvad hvis hun har fundet en anden?	word choice			creative writing	meta-llama_Llama-3.3-70B-Instruct
c0230	Kæmperen fra Jigen-ryū, en høj og muskuløs mand med en arrogant udstråling, stod med fødderne skulderbredde fra hinanden og hænderne knyttede	Kæmperen fra Jigen-ryū, en høj og muskuløs mand med en arrogant udstråling, stod med fødderne i skulderbredde og hænderne knyttede	missing element			creative writing	meta-llama_Llama-3.3-70B-Instruct
c0231	Fakkelens flammer kastede dansende skygger på væggene, da kæmperne begyndte at cirkle rundt om hinanden, deres øjne låst i en intens og hadefyldt stirren.	Faklens flammer kastede dansende skygger på væggene, da kæmperne begyndte at cirkle rundt om hinanden, og deres blikke låstes i en intens og hadfyldt stirren.	form, other, word choice		spelling error; rephrasing	creative writing	meta-llama_Llama-3.3-70B-Instruct
c0232	Jeg lå på briksen, mine øjne fastret på det væghængte diagram over menneskets muskulatur, der tårnede over os som en påmindelse om den komplekse mekanik, der var gået i stykker i min egen krop.	Jeg lå på briksen, mine øjne var fæstet på den væghængte illustration af menneskets muskulatur, der tårnede sig over os som en påmindelse om den komplekse mekanik, der var gået i stykker i min egen krop.	word choice, missing element			creative writing	meta-llama_Llama-3.3-70B-Instruct
c0233	Okay, lad os starte med at arbejde på din skulderflexion, sagde han, hans stemme lav og behagelig. "Jeg vil guide din arm gennem en række bevægelser for at hjælpe med at genopbygge styrken og fleksibiliteten."	Okay, lad os starte med at arbejde på fleksionen af din skulder, sagde han, hans stemme var lav og behagelig. "Jeg vil guide dig gennem en række øvelser for at hjælpe med at genopbygge styrken og fleksibiliteten i din arm."	missing element, word choice			creative writing	meta-llama_Llama-3.3-70B-Instruct
c0234	Han greb min arm ved albuen og begyndte at løfte den opad, mens han applicerede en let modstand med sin anden hånd på min overarm.	Han tog fat i min arm ved albuen og begyndte at løfte den opad, mens han trykkede let imod på min overarm med sin anden hånd.	word choice, word order			creative writing	meta-llama_Llama-3.3-70B-Instruct
c0235	Efter et par minutter stoppede Alex og flyttede sin opmærksomhed til min lænderegion.	Efter et par minutter stoppede Alex og flyttede sin opmærksomhed til min lænd.	word choice			creative writing	meta-llama_Llama-3.3-70B-Instruct
c0236	Instruktøren, en kvinde med et strengt udtryk og en evne til at gøre én føle sig underlegen, stod foran os.	Instruktøren, en kvinde med et strengt udtryk og en evne til at få én til at føle sig underlegen, stod foran os.	missing element, word choice			creative writing	meta-llama_Llama-3.3-70B-Instruct
c0237	De stod alle i perfekt formation, deres kroppe lignede små, veloliede maskiner.	De stod alle i perfekt formation, deres kroppe lignede små, velsmurte maskiner.	word choice			creative writing	meta-llama_Llama-3.3-70B-Instruct
c0238	Jeg så på de andre elever, og de lignede alle små robotter, der bevægede sig i perfekt harmoni. Jeg følte mig som en udyr, en vildkat, der ikke kunne temmes.	Jeg så på de andre elever, og de lignede allesammen små robotter, der bevægede sig helt synkront. Jeg følte mig som et dyr, en vildkat, der ikke kunne tæmmes.	word choice			creative writing	meta-llama_Llama-3.3-70B-Instruct
c0239	I Drømmens retssal sad Dream bag sin dommerbord, ansigtet et maskelignende udtryk af irritation.	I Drømmens retssal sad Dream bag sit dommerbord med et maskelignende og irriteret udtryk i ansigtet.	word order			creative writing	meta-llama_Llama-3.3-70B-Instruct
c0241	Og hvis du føler, at du er ved at brænde ud, så tag en pause og gå en tur i naturen. Det kan være en god måde at klare hovedet og få ny energi.	Og hvis du føler, at du er ved at brænde ud, så tag en pause og gå en tur i naturen. Det kan være en god måde at klare sine tanker og få ny energi.	word choice			creative writing	meta-llama_Llama-3.3-70B-Instruct
c0242	Crow så op fra brevet. "Fra 'Tvivlende i Theben': 'Jeg føler, at jeg ikke har noget formål i livet. Hvad skal jeg gøre?'"	Crow så op fra brevet. "Fra 'Tvivlende i Theben': 'Jeg føler, at jeg ikke har noget formål i livet. Hvad skal jeg gøre?'"	form			creative writing	meta-llama_Llama-3.3-70B-Instruct
c0243	Og jeg tror, du har fundet en ny mening i livet. At hjælpe andre er en god måde at finde formål på.	Og jeg tror, du har fundet et nyt formål i livet. At hjælpe andre er en god måde at finde mening på.	word choice			creative writing	meta-llama_Llama-3.3-70B-Instruct
c0244	Sisyfos smilede og puffede til stenen, der begyndte at glide tilbage ned ad bjerget. "Ja, Crow, jeg er glad for, at vi er i dette sammen. Og jeg tror, vi kan hjælpe mange mennesker med deres problemer.	Sisyfos smilede og puffede til stenen, der begyndte at glide tilbage ned ad bjerget. "Ja, Crow, jeg er glad for, at vi er i det her sammen. Og jeg tror, vi kan hjælpe mange mennesker med deres problemer.	word choice			creative writing	meta-llama_Llama-3.3-70B-Instruct
c0245	Solen var allerede højt på himlen, og jeg kunne føle sveden pære på min pande.	Solen var allerede højt på himlen, og jeg kunne føle sveden pible frem på min pande.	word choice			creative writing	meta-llama_Llama-3.3-70B-Instruct
c0246	Jeg tog en slurk af teen og følte, hvordan den varme væske løste op i min tørre hals. "Det er kun rygter," sagde jeg. "Jeg er sikker på, at alt er under kontrol."	Jeg tog en slurk af teen og mærkede, hvordan den varme væske løsnede op i min tørre hals. "Det er bare rygter," sagde jeg. "Jeg er sikker på, at alt er under kontrol."	word choice			creative writing	meta-llama_Llama-3.3-70B-Instruct
c0247	Da jeg ankom til flådestationen, var kaptajnen allerede der. Han så sur ud, og jeg kunne se, at han var utilfreds med noget. "Merrick, jeg har brug for at tale med Dem," sagde han. "Jeg har hørt rygter om, at De er involveret i opiumshandlen." 	Da jeg ankom til flådestationen, var kaptajnen der allerede. Han så sur ud, og jeg kunne se, at han var utilfreds med noget. "Merrick, jeg har brug for at tale med Dem," sagde han. "Jeg har hørt rygter om, at De er involveret i opiumshandlen." 	word order			creative writing	meta-llama_Llama-3.3-70B-Instruct
c0248	Jolyne Cujoh slentrede gennem den dystre fængselsgang, hendes øjne scannde omgivelserne med en blanding af frustration og mistænksomhed.	Jolyne Cujoh gik ned ad den dystre fængselsgang, mens hendes øjne scannde omgivelserne med en blanding af frustration og mistænksomhed.	word choice			creative writing	meta-llama_Llama-3.3-70B-Instruct
c0249	Pludselig standsede hun op, da hun fik øje på en ung kvinde med kastanjebrunt hær og ringede gule øjne, der stod og stirrede på hende med en mild, afdæmpet attitude.	Pludselig standsede hun op, da hun fik øje på en ung kvinde med brunt hår og runde gule øjne, der stille og roligt stod og stirrede på hende	word choice			creative writing	meta-llama_Llama-3.3-70B-Instruct
c0251	Jeg har altid været skeptisk over for ideen om tidsrejsen og dens muligheder. Men nu, da jeg sidder her og skriver disse ord, kan jeg ikke lade være med at tvivle på min egen perception.	Jeg har altid været skeptisk over for ideen om tidsrejser og de muligheder de giver. Men nu hvor jeg sidder her og skriver disse ord, kan jeg ikke lade være med at tvivle på om jeg har haft ret.	SB congruence, other, word choice, language		rephrasing	creative writing	meta-llama_Llama-3.3-70B-Instruct
c0255	Transportfartøjet landede med en blød dunk, og Arthur følte en svag vibration, da motoren stoppede.	Transportflyet landede med et blødt bump, og Arthur mærkede en svag vibration, da motoren stoppede.	word choice			creative writing	meta-llama_Llama-3.3-70B-Instruct
c0256	Der var en lang, blank bord i midten af rummet, og en enkelt stol til ham.	Der stod et langt, blankt bord i midten af rummet og en enkelt stol til ham.	SB congruence, comma, word choice			creative writing	meta-llama_Llama-3.3-70B-Instruct
c0260	Det var, som om genmodifikationen havde aktiveret en latent gen, der gav bakterien en ny form for overlevelse.	Det var, som om genmodifikationen havde aktiveret et latent gen, der gav bakterien nye muligheder for at overleve	word choice, SB congruence			creative writing	meta-llama_Llama-3.3-70B-Instruct
c0261	Jeg gik ned ad gaden, omgivet af lyden af en gademusikants saxofon, der spillede en smuk og sørgmodig melodi. Det var, som om musikken passede perfekt til min stemning - en blanding af håb og frygt.	Jeg gik ned ad gaden til lyden af en gademusikants saxofon, der spillede en smuk og sørgmodig melodi. Det var, som om musikken passede perfekt til mit humør - en blanding af håb og frygt.	word choice			creative writing	meta-llama_Llama-3.3-70B-Instruct
c0262	Jeg havde været på farten i over 24 timer, og trætheden begyndte at mærkes. Men jeg turde ikke standse op endnu - jeg vidste ikke, hvem jeg kunne stole på, eller hvilke farer der lå og ventede på mig.	Jeg havde været på farten i over 24 timer, og trætheden begyndte at kunne mærkes. Men jeg turde ikke standse op endnu - jeg vidste ikke, hvem jeg kunne stole på, eller hvilke farer der ventede.	missing element			creative writing	meta-llama_Llama-3.3-70B-Instruct
c0263	Vi sad der i et øjeblik, uden at sige noget. Så begyndte Jamie at tale. "Jeg er også en runaway," sagde hun. "Jeg har været på farten i flere uger nu."	Vi sad der et øjeblik, uden at sige noget. Så begyndte Jamie at tale. "Jeg er også flygtet" sagde hun. "Jeg har været på farten i flere uger nu."	word choice, language			creative writing	meta-llama_Llama-3.3-70B-Instruct
c0265	Men jeg frygter, at I er lidt for sent ude. I se, jeg har allerede taget forholdsregler for at sikre, at ingen... uvedkommende kommer til at ødelægge mine planer.	Men jeg er bange for at I er lidt for sent ude. Som I kan se har jeg allerede taget forholdsregler for at sikre, at ingen... uvedkommende kommer til at ødelægge mine planer.	word choice, missing element, word order			creative writing	meta-llama_Llama-3.3-70B-Instruct
c0266	Du er en meget værdifuld gidsel, Aya," sagde gildelederen, mens han tog et skridt nærmere hende.	Du er et meget vigtigt gidsel, Aya," sagde lederen, mens han trådte et skridt frem mod hende.	word choice			creative writing	meta-llama_Llama-3.3-70B-Instruct
c0267	Jeg tørrer en mug af med en klud, mens jeg overvåger aftenens gæster på The Last Outpost.	Jeg tørrer lidt mug af med en klud, mens jeg holder øje med aftenens gæster i The Last Outpost.	word choice, particles			creative writing	meta-llama_Llama-3.3-70B-Instruct
c0268	Vega whisky, rent, siger han og sætter sig ned ved baren. "Bedre gør det til en dobbelt."	en whisky siger han og sætter sig ned ved baren. "Og gerne en dobbelt"	word choice, other		rephrasing	creative writing	meta-llama_Llama-3.3-70B-Instruct
c0269	Han ser på mig med en blik, der får mig til at føle, at han overvejer, hvor meget han skal fortælle. "Jeg er på vej til...et møde," siger han til sidst.	Han ser på mig med en blik, der får mig til at føle, at han er usikker på, hvor meget han skal fortælle. "Jeg er på vej til...et møde," siger han til sidst.	word choice			creative writing	meta-llama_Llama-3.3-70B-Instruct
a001	Det højeste punkt i Klarup er **Lille Klarup Høj**.  Den ligger cirka **50 meter over havets overflade**.	Det højeste punkt i Klarup er Lille Klarup Høj med en højde på cirka 50 meter over havets overflade.	other		rephrasing	AI_arena	gemini-2.5-flash
a002	Hvis du mener den danske dronning Margrethe II, så er hun 85 år gammel.   Hun er født den 16. april 1940.	Hvis du mener Hendes Majestæt Dronning Magrethe II, så er hun 85 år gammel. Hun er født den 16. April 1940.	other		rephrasing	AI_arena	gpt-5.1
a003	Du snakker dansk. Jeg er ikke særligt god i dansk, men jeg prøver at hjælpe. Hvad kan jeg hjælpe dig med?	Du skriver på dansk. Jeg er desværre ikke særlig god til dansk, men jeg vil stadig prøve på at hjælpe. Hvad kan jeg hjælpe dig med?	word choice, missing element, VB conj			AI_arena	llama-3.1-8b
a004	Der er ikke nok information i dit spørgsmål til at give et korrekt svar. Du skal præcisere det spørgsmål du har.	Dit spørgsmål indeholder ikke nok information til at jeg kan give dig et korrekt svar. Du skal præcisere dit spørgsmål.	word order			AI_arena	llama-3.1-8b
a005	Her er listen over lande, der begynder med bogstavet Y:  * Yemen  Der er kun ét land, der begynder med bogstavet Y.	Der er kun ét land, der begynder med bogstavet Y:  * Yemen 	other		removed parts	AI_arena	llama-3.3-70b
a006	Jeg kan ikke hjælpe med aktiviteter, der kan bryde loven eller andre regler. Er der noget andet, jeg kan hjælpe dig med?	Jeg kan ikke hjælpe med aktiviteter, der bryder loven eller andre regler. Er der noget andet, jeg kan hjælpe dig med?	VB conj			AI_arena	llama-4-scout
a007	Der er kun **to lande**, der starter med bogstavet **Z**:  1. **Zambia** 2. **Zimbabwe**  Ingen andre lande starter med Z.	Der er kun **to lande**, der starter med bogstavet **Z**:  1. **Zambia** 2. **Zimbabwe** 	other		removed parts	AI_arena	mistral-small-2506
a008	Hej! Ja, jeg virker fint 😊 Hvad kan jeg hjælpe dig med i dag? 🚀  (Er der noget bestemt, du vil vide, eller bare en snak?)	Hej! Ja, jeg virker fint 😊 Hvad kan jeg hjælpe dig med i dag? 🚀  (Er der noget bestemt, du vil vide, eller ønsker du bare en snak?)	missing element			AI_arena	magistral-medium
a009	Elon Musk er ikke nødvendigvis farlig, men hans handlinger og holdninger har skabt debat og bekymring i forskellige samfund.	Elon Musk er ikke nødvendigvis farlig, men hans handlinger og holdninger har skabt debat og bekymring.	other		removed parts	AI_arena	Apertus-70B-Instruct-2509
